{
  "source_id": "SOURCE_VULNERABLE_FACILITIES",
  "selected_access_option_id": "ACCESS_VULNERABLE_FACILITIES_GJ_SENIOR_NURSING_CSV",
  "verification_status": "coverage_verified",
  "sample_path": "data/raw/SOURCE_VULNERABLE_FACILITIES/snapshots/regional_clip/",
  "pipeline_path": "pipelines/SOURCE_VULNERABLE_FACILITIES/",
  "raw_fields_observed": [
    "연번",
    "시도",
    "시군구",
    "시설명",
    "시설종류",
    "장기요양지정기관여부",
    "시설입소현황(정원)",
    "시설입소현황(남)",
    "시설입소현황(여)",
    "종사자수(남)",
    "종사자수(여)",
    "소재지도로명주소",
    "전화번호",
    "팩스번호",
    "시설설치일자",
    "설치주체(민간)",
    "운영주체(법인(단체)명)",
    "운영주체(설치주체)",
    "운영주체(영리구분)",
    "휴업중",
    "데이터기준일자",
    "apiSeq",
    "city",
    "location",
    "posX",
    "posY",
    "space_key",
    "scenario_time",
    "valid_from",
    "valid_to",
    "mock_source"
  ],
  "time_key_field": "데이터기준일자; scenario_time, valid_from, valid_to for Jeonnam mock fallback",
  "time_parse_result": "pass",
  "space_key_field": "시도, 시군구, 소재지도로명주소; space_key, city, emd_code, location, posX, posY for Jeonnam mock fallback",
  "space_validation_result": "pass",
  "native_crs": "no_geometry for real files; EPSG:4326 synthetic points for Jeonnam mock fallback",
  "native_time_format": "YYYY-MM-DD; ISO-8601 with timezone for mock scenario fields",
  "decision": "accept_with_gap",
  "open_issues": [
    "Full snapshot saved under full_gwangju_jeonnam_20260430 with Gwangju senior nursing/medical welfare files and Jeonnam nursing hospital file.",
    "Jeonnam elderly welfare API returned HTTP 404 after the 2026-05-01 retry; generated fallback saved under data/mock/SOURCE_VULNERABLE_FACILITIES/scenario_baseline/.",
    "Mock fallback covers 1,774 Jeonnam rows across all 22 sigungu and five elderly-welfare classes. Gwangju mock generation was skipped because real Gwangju vulnerable-facility files already exist.",
    "Mock coordinates are synthetic points inside admin boundaries and are not geocoded official facility locations."
  ]
}
